{
  "$schema": "http://json-schema.org/draft-07/schema#",
  "title": "service-profile",
  "description": "validated by scripts/validate-artifact.sh via x-required / x-required-item / x-required-when hints (not standard JSON Schema 'required'). source_urls and *.source_url hold a URL (web) or a local file path (local_dir).",
  "type": "object",
  "x-required": ["source_urls", "captured_at", "source_type", "icp", "positioning", "evidence", "channel_signals"],
  "x-required-when": [
    { "field": "voc", "when": { "source_type": "web" } }
  ],
  "properties": {
    "source_urls": { "type": "array", "items": { "type": "string" } },
    "captured_at": { "type": "string", "description": "ISO-8601 timestamp" },
    "source_type": { "type": "string", "enum": ["web", "local_dir"] },
    "icp": {
      "type": "object",
      "x-required": ["segment", "pains", "goals"],
      "properties": {
        "segment": { "type": "string" },
        "pains": { "type": "array", "items": { "type": "string" } },
        "goals": { "type": "array", "items": { "type": "string" } }
      }
    },
    "voc": {
      "type": "array",
      "description": "voice-of-customer quotes from reviews/social (web only; required when source_type=web)",
      "items": {
        "type": "object",
        "x-required-item": ["quote", "source_url"],
        "properties": {
          "quote": { "type": "string" },
          "source_url": { "type": "string" },
          "sentiment": { "type": "string" }
        }
      }
    },
    "positioning": {
      "type": "object",
      "x-required": ["value_prop", "category"],
      "properties": {
        "value_prop": { "type": "string" },
        "category": { "type": "string" },
        "differentiators": { "type": "array", "items": { "type": "string" } }
      }
    },
    "evidence": {
      "type": "array",
      "description": "every claim ties to a source",
      "items": {
        "type": "object",
        "x-required-item": ["claim", "source_url"],
        "properties": {
          "claim": { "type": "string" },
          "source_url": { "type": "string" }
        }
      }
    },
    "channel_signals": {
      "type": "object",
      "x-required": ["product_type", "market", "price_model", "target", "discovery_intent"],
      "properties": {
        "product_type": { "type": "string", "enum": ["mobile_app", "web_saas"] },
        "market": { "type": "string", "enum": ["kr", "global", "both"] },
        "price_model": { "type": "string", "enum": ["free", "freemium", "paid", "subscription"] },
        "target": { "type": "string", "enum": ["b2c", "b2b"] },
        "discovery_intent": { "type": "string", "enum": ["high", "low"] }
      }
    }
  }
}
